{
  "specversion": "1.0",
  "id": "0192f1d0-3c5a-7e21-8a4b-000000000010",
  "source": "/core",
  "type": "whitetower.agent.created.v1",
  "time": "2026-09-29T10:15:02.118Z",
  "subject": "0192f1c2-7a3b-7c4d-8e5f-000000000001",
  "datacontenttype": "application/json",
  "data": {
    "slug": "invoice-triage",
    "kind": "in_house",
    "risk_tier": "high",
    "use_case_id": "0192f1c2-7a3b-7c4d-8e5f-000000000010",
    "primary_owner": "0192f1c2-7a3b-7c4d-8e5f-0000000000a1",
    "actor": {
      "type": "human",
      "id": "0192f1c2-7a3b-7c4d-8e5f-0000000000a1"
    },
    "state_version": 812
  }
}
