{
  "specversion": "1.0",
  "id": "0192f1d0-3c5a-7e21-8a4b-000000000005",
  "source": "/agents/0192f1c2-7a3b-7c4d-8e5f-000000000001/ep/b7e2c1d4",
  "type": "whitetower.bundle.activated.v1",
  "time": "2026-09-29T10:15:02.118Z",
  "subject": "0192f1c2-7a3b-7c4d-8e5f-000000000001",
  "datacontenttype": "application/json",
  "wtseq": "1040",
  "data": {
    "version": 42,
    "manifest_sha256": "d330970434583a6fe6908fb8a6111422c0fc01c789581480af3c43c6632a625e",
    "policies": 2,
    "previous_version": 41
  }
}
