{
  "specversion": "1.0",
  "id": "0192f1d0-3c5a-7e21-8a4b-000000000002",
  "source": "/agents/0192f1c2-7a3b-7c4d-8e5f-000000000001/ep/b7e2c1d4",
  "type": "whitetower.action.executed.v1",
  "time": "2026-09-29T10:15:02.118Z",
  "subject": "0192f1c2-7a3b-7c4d-8e5f-000000000001",
  "datacontenttype": "application/json",
  "wtseq": "1045",
  "traceparent": "00-4bf92f3577b34da6a3ce929d0e0e4736-00f067aa0ba902b7-01",
  "data": {
    "decision_id": "0192f1d0-3c5a-7e21-8a4b-1c2d3e4f5061",
    "action": "tool.invoke",
    "resource": {
      "type": "tool",
      "id": "read_invoice"
    },
    "outcome": "succeeded",
    "duration_ms": 184
  }
}
