{
  "specversion": "1.0",
  "id": "0192f1d0-3c5a-7e21-8a4b-000000000009",
  "source": "/modules/k8s-quarantine/prod-eu-1",
  "type": "whitetower.quarantine.lifted.v1",
  "time": "2026-09-29T10:15:02.118Z",
  "subject": "0192f1c2-7a3b-7c4d-8e5f-000000000001",
  "datacontenttype": "application/json",
  "wtseq": "97",
  "data": {
    "workloads": 3,
    "rule": "whitetower-quarantine-0192f1c2-7a3b-7c4d-8e5f-000000000001",
    "cluster": "prod-eu-1"
  }
}
