{
  "specversion": "1.0",
  "id": "0192f1d0-3c5a-7e21-8a4b-000000000008",
  "source": "/modules/k8s-quarantine/prod-eu-1",
  "type": "whitetower.quarantine.applied.v1",
  "time": "2026-09-29T10:15:02.118Z",
  "subject": "0192f1c2-7a3b-7c4d-8e5f-000000000001",
  "datacontenttype": "application/json",
  "wtseq": "88",
  "data": {
    "halt_ids": [
      "0192f1c3-0d4e-7a10-9b2c-000000000040"
    ],
    "workloads": 3,
    "rule": "whitetower-quarantine-0192f1c2-7a3b-7c4d-8e5f-000000000001",
    "cluster": "prod-eu-1",
    "cni": "cilium"
  }
}
