{
  "specversion": "1.0",
  "id": "0192f1d0-3c5a-7e21-8a4b-000000000024",
  "source": "/core",
  "type": "whitetower.agent.ownership_changed.v1",
  "time": "2026-10-19T11:02:47.311Z",
  "subject": "0192f1c2-7a3b-7c4d-8e5f-000000000001",
  "datacontenttype": "application/json",
  "data": {
    "change": "owner_reassigned",
    "principal_id": "0192f1c2-7a3b-7c4d-8e5f-0000000000a4",
    "former_owner": "0192f1c2-7a3b-7c4d-8e5f-0000000000a1",
    "actor": {
      "type": "human",
      "id": "0192f1c2-7a3b-7c4d-8e5f-0000000000a3"
    },
    "state_version": 816
  }
}
