{
  "specversion": "1.0",
  "id": "0192f1d0-3c5a-7e21-8a4b-000000000021",
  "source": "/core",
  "type": "whitetower.use_case.created.v1",
  "time": "2026-10-19T09:12:40.031Z",
  "datacontenttype": "application/json",
  "data": {
    "use_case_id": "0192f1c2-7a3b-7c4d-8e5f-000000000010",
    "ai_act_classification": "limited",
    "data_categories": [
      "financial_data",
      "internal_documents"
    ],
    "actor": {
      "type": "human",
      "id": "0192f1c2-7a3b-7c4d-8e5f-0000000000a1"
    }
  }
}
