{
  "specversion": "1.0",
  "id": "0192f1d0-3c5a-7e21-8a4b-000000000001",
  "source": "/agents/0192f1c2-7a3b-7c4d-8e5f-000000000001/ep/b7e2c1d4",
  "type": "whitetower.decision.made.v1",
  "time": "2026-09-29T10:15:02.118Z",
  "subject": "0192f1c2-7a3b-7c4d-8e5f-000000000001",
  "datacontenttype": "application/json",
  "wtseq": "1043",
  "traceparent": "00-4bf92f3577b34da6a3ce929d0e0e4736-00f067aa0ba902b7-01",
  "data": {
    "decision": "deny",
    "reason": "policy.forbid",
    "action": "tool.invoke",
    "resource": {
      "type": "tool",
      "id": "send_email"
    },
    "environment": "production",
    "policies": [
      "0192f1c2-7a3b-7c4d-8e5f-000000000101"
    ],
    "bundle_version": 42,
    "state_version": 918,
    "evaluation_us": 310,
    "task_id": "run-7f41",
    "arguments": {
      "names": [
        "to",
        "subject",
        "body"
      ]
    }
  }
}
