{
  "specversion": "1.0",
  "id": "0192f1d0-3c5a-7e21-8a4b-000000000003",
  "source": "/agents/0192f1c2-7a3b-7c4d-8e5f-000000000001/ep/b7e2c1d4",
  "type": "whitetower.instance.started.v1",
  "time": "2026-09-29T10:15:02.118Z",
  "subject": "0192f1c2-7a3b-7c4d-8e5f-000000000001",
  "datacontenttype": "application/json",
  "wtseq": "1",
  "data": {
    "module": "ep-python",
    "module_version": "0.1.0",
    "contract_version": "v1alpha1",
    "instance_id": "0192f1c2-9e00-7c4d-8e5f-000000000051",
    "components": {
      "python": "3.13.1",
      "langgraph": "1.2.0",
      "cedarpy": "4.12.1"
    }
  }
}
