{
  "specversion": "1.0",
  "id": "0192f1d0-3c5a-7e21-8a4b-000000000022",
  "source": "/core",
  "type": "whitetower.audit.read.v1",
  "time": "2026-10-16T10:00:00.000Z",
  "subject": "0192f1c2-7a3b-7c4d-8e5f-000000000001",
  "datacontenttype": "application/json",
  "data": {
    "actor": {
      "type": "human",
      "id": "0192f1c2-7a3b-7c4d-8e5f-000000000002"
    },
    "operation": "query",
    "query": {
      "agent_id": "0192f1c2-7a3b-7c4d-8e5f-000000000001",
      "type": "whitetower.decision.made.v1"
    },
    "results_count": 5
  }
}
